{
  "$schema": "./components.schema.json",
  "version": "0.2.0",
  "packages": {
    "tokens": "@cool-ui/tokens",
    "wechat": "@cool-ui/wechat",
    "swift": "CoolUI",
    "android": "dev.coolui:coolui-compose",
    "harmony": "@cool-ui/arkui"
  },
  "semanticTypes": {
    "ThemeMode": ["system", "light", "dark"],
    "GlassMaterial": ["clear", "regular", "prominent", "solidFallback"],
    "Tone": ["neutral", "accent", "success", "warning", "danger"],
    "Size": ["small", "medium", "large"],
    "ContrastMode": ["standard", "high"],
    "MotionMode": ["full", "reduced"],
    "TransparencyMode": ["full", "reduced"]
  },
  "components": [
    {"name":"ThemeProvider","category":"foundations","platforms":["swiftui","compose","arkui","wechat"],"interactive":false,"api":{"kind":"provider","valueType":"none","events":[],"slots":["content"]},"maturity":{"swiftui":"planned","compose":"planned","arkui":"planned","wechat":"planned"}},
    {"name":"Backdrop","category":"foundations","platforms":["swiftui","compose","arkui","wechat"],"interactive":false,"api":{"kind":"container","valueType":"none","events":[],"slots":["background","content"]},"maturity":{"swiftui":"planned","compose":"planned","arkui":"planned","wechat":"planned"}},
    {"name":"GlassSurface","category":"foundations","platforms":["swiftui","compose","arkui","wechat"],"interactive":false,"api":{"kind":"container","valueType":"none","events":[],"slots":["content"]},"maturity":{"swiftui":"planned","compose":"planned","arkui":"planned","wechat":"planned"}},
    {"name":"GlassGroup","category":"foundations","platforms":["swiftui","compose","arkui","wechat"],"interactive":false,"api":{"kind":"container","valueType":"none","events":[],"slots":["content"]},"maturity":{"swiftui":"planned","compose":"planned","arkui":"planned","wechat":"planned"}},
    {"name":"Divider","category":"foundations","platforms":["swiftui","compose","arkui","wechat"],"interactive":false,"api":{"kind":"content","valueType":"none","events":[],"slots":[]},"maturity":{"swiftui":"planned","compose":"planned","arkui":"planned","wechat":"planned"}},
    {"name":"Button","category":"actions-inputs","platforms":["swiftui","compose","arkui","wechat"],"interactive":true,"states":["default","pressed","focused","selected","disabled","loading","error"],"capabilities":["controlledValue","event","accessibilityLabel","semanticIconSlot"],"api":{"kind":"action","valueType":"none","events":["activate"],"slots":["label","leadingIcon","trailingIcon"]},"maturity":{"swiftui":"planned","compose":"planned","arkui":"planned","wechat":"planned"}},
    {"name":"IconButton","category":"actions-inputs","platforms":["swiftui","compose","arkui","wechat"],"interactive":true,"states":["default","pressed","focused","selected","disabled","loading","error"],"capabilities":["controlledValue","event","accessibilityLabel","semanticIconSlot"],"api":{"kind":"action","valueType":"none","events":["activate"],"slots":["icon"]},"maturity":{"swiftui":"planned","compose":"planned","arkui":"planned","wechat":"planned"}},
    {"name":"FloatingActionButton","category":"actions-inputs","platforms":["swiftui","compose","arkui","wechat"],"interactive":true,"states":["default","pressed","focused","selected","disabled","loading","error"],"capabilities":["controlledValue","event","accessibilityLabel","semanticIconSlot"],"api":{"kind":"action","valueType":"none","events":["activate"],"slots":["icon","label"]},"maturity":{"swiftui":"planned","compose":"planned","arkui":"planned","wechat":"planned"}},
    {"name":"Chip","category":"actions-inputs","platforms":["swiftui","compose","arkui","wechat"],"interactive":true,"states":["default","pressed","focused","selected","disabled","loading","error"],"capabilities":["controlledValue","event","accessibilityLabel","semanticIconSlot"],"api":{"kind":"booleanInput","valueType":"boolean","events":["change"],"slots":["label","icon"]},"maturity":{"swiftui":"planned","compose":"planned","arkui":"planned","wechat":"planned"}},
    {"name":"TextField","category":"actions-inputs","platforms":["swiftui","compose","arkui","wechat"],"interactive":true,"states":["default","pressed","focused","selected","disabled","loading","error"],"capabilities":["controlledValue","event","accessibilityLabel","semanticIconSlot"],"api":{"kind":"textInput","valueType":"string","events":["change","submit"],"slots":["label","leadingIcon","trailingIcon"]},"maturity":{"swiftui":"planned","compose":"planned","arkui":"planned","wechat":"planned"}},
    {"name":"TextArea","category":"actions-inputs","platforms":["swiftui","compose","arkui","wechat"],"interactive":true,"states":["default","pressed","focused","selected","disabled","loading","error"],"capabilities":["controlledValue","event","accessibilityLabel","semanticIconSlot"],"api":{"kind":"textInput","valueType":"string","events":["change"],"slots":["label"]},"maturity":{"swiftui":"planned","compose":"planned","arkui":"planned","wechat":"planned"}},
    {"name":"SearchField","category":"actions-inputs","platforms":["swiftui","compose","arkui","wechat"],"interactive":true,"states":["default","pressed","focused","selected","disabled","loading","error"],"capabilities":["controlledValue","event","accessibilityLabel","semanticIconSlot"],"api":{"kind":"textInput","valueType":"string","events":["change","submit","clear"],"slots":["leadingIcon"]},"maturity":{"swiftui":"planned","compose":"planned","arkui":"planned","wechat":"planned"}},
    {"name":"Toggle","category":"actions-inputs","platforms":["swiftui","compose","arkui","wechat"],"interactive":true,"states":["default","pressed","focused","selected","disabled","loading","error"],"capabilities":["controlledValue","event","accessibilityLabel","semanticIconSlot"],"api":{"kind":"booleanInput","valueType":"boolean","events":["change"],"slots":["label"]},"maturity":{"swiftui":"planned","compose":"planned","arkui":"planned","wechat":"planned"}},
    {"name":"Checkbox","category":"actions-inputs","platforms":["swiftui","compose","arkui","wechat"],"interactive":true,"states":["default","pressed","focused","selected","disabled","loading","error"],"capabilities":["controlledValue","event","accessibilityLabel","semanticIconSlot"],"api":{"kind":"booleanInput","valueType":"boolean","events":["change"],"slots":["label"]},"maturity":{"swiftui":"planned","compose":"planned","arkui":"planned","wechat":"planned"}},
    {"name":"RadioGroup","category":"actions-inputs","platforms":["swiftui","compose","arkui","wechat"],"interactive":true,"states":["default","pressed","focused","selected","disabled","loading","error"],"capabilities":["controlledValue","event","accessibilityLabel","semanticIconSlot"],"api":{"kind":"choiceInput","valueType":"string","events":["change"],"slots":["label","option"]},"maturity":{"swiftui":"planned","compose":"planned","arkui":"planned","wechat":"planned"}},
    {"name":"Slider","category":"actions-inputs","platforms":["swiftui","compose","arkui","wechat"],"interactive":true,"states":["default","pressed","focused","selected","disabled","loading","error"],"capabilities":["controlledValue","event","accessibilityLabel","semanticIconSlot"],"api":{"kind":"numericInput","valueType":"number","events":["change"],"slots":["label","minimumLabel","maximumLabel"]},"maturity":{"swiftui":"planned","compose":"planned","arkui":"planned","wechat":"planned"}},
    {"name":"Stepper","category":"actions-inputs","platforms":["swiftui","compose","arkui","wechat"],"interactive":true,"states":["default","pressed","focused","selected","disabled","loading","error"],"capabilities":["controlledValue","event","accessibilityLabel","semanticIconSlot"],"api":{"kind":"numericInput","valueType":"number","events":["change"],"slots":["label"]},"maturity":{"swiftui":"planned","compose":"planned","arkui":"planned","wechat":"planned"}},
    {"name":"Select","category":"actions-inputs","platforms":["swiftui","compose","arkui","wechat"],"interactive":true,"states":["default","pressed","focused","selected","disabled","loading","error"],"capabilities":["controlledValue","event","accessibilityLabel","semanticIconSlot"],"api":{"kind":"choiceInput","valueType":"string","events":["change"],"slots":["label","option"]},"maturity":{"swiftui":"planned","compose":"planned","arkui":"planned","wechat":"planned"}},
    {"name":"DatePicker","category":"actions-inputs","platforms":["swiftui","compose","arkui","wechat"],"interactive":true,"states":["default","pressed","focused","selected","disabled","loading","error"],"capabilities":["controlledValue","event","accessibilityLabel","semanticIconSlot"],"api":{"kind":"dateInput","valueType":"date","events":["change"],"slots":["label"]},"maturity":{"swiftui":"planned","compose":"planned","arkui":"planned","wechat":"planned"}},
    {"name":"TimePicker","category":"actions-inputs","platforms":["swiftui","compose","arkui","wechat"],"interactive":true,"states":["default","pressed","focused","selected","disabled","loading","error"],"capabilities":["controlledValue","event","accessibilityLabel","semanticIconSlot"],"api":{"kind":"dateInput","valueType":"date","events":["change"],"slots":["label"]},"maturity":{"swiftui":"planned","compose":"planned","arkui":"planned","wechat":"planned"}},
    {"name":"TopBar","category":"navigation","platforms":["swiftui","compose","arkui","wechat"],"interactive":true,"states":["default","pressed","focused","selected","disabled","loading","error"],"capabilities":["controlledValue","event","accessibilityLabel","semanticIconSlot"],"api":{"kind":"navigation","valueType":"none","events":["activate"],"slots":["title","leading","actions"]},"maturity":{"swiftui":"planned","compose":"planned","arkui":"planned","wechat":"planned"}},